#set( $symbol_pound = '#' )
#set( $symbol_dollar = '$' )
#set( $symbol_escape = '\' )
<?xml version='1.0' encoding='us-ascii'?>

<!DOCTYPE apptbook
        PUBLIC "-//Joy of Coding at PSU//DTD Appointment Book//EN" "apptbook.dtd">

<apptbook>
  <owner>Example Appointment Book</owner>
  <appt>
    <begin>
      <date day="11" month="10" year="2023"/>
      <time hour="13" minute="6"/>
    </begin>
    <end>
      <date day="11" month="10" year="2023"/>
      <time hour="14" minute="0"/>
    </end>
    <description>Example Appointment</description>
  </appt>
</apptbook>
